{
  "schemaVersion": 1,
  "id": "public-production-licenses-v1",
  "allowedSpdxExpressions": [
    "0BSD",
    "Apache-2.0",
    "BSD-2-Clause",
    "BSD-3-Clause",
    "BlueOak-1.0.0",
    "CC0-1.0",
    "ISC",
    "MIT",
    "MIT-0",
    "PSF-2.0",
    "Python-2.0",
    "Unlicense"
  ],
  "deniedSpdxExpressions": [
    "AGPL-1.0-only",
    "AGPL-1.0-or-later",
    "AGPL-3.0-only",
    "AGPL-3.0-or-later",
    "SSPL-1.0"
  ],
  "reviewRequiredSpdxExpressions": [
    "EPL-1.0",
    "EPL-2.0",
    "GPL-2.0-only",
    "GPL-2.0-or-later",
    "GPL-3.0-only",
    "GPL-3.0-or-later",
    "LGPL-2.0-only",
    "LGPL-2.0-or-later",
    "LGPL-2.1-only",
    "LGPL-2.1-or-later",
    "LGPL-3.0-only",
    "LGPL-3.0-or-later",
    "MPL-2.0"
  ],
  "unknownDisposition": "blocked",
  "reviewDisposition": "blocked"
}
